[
  {
    "id": "concept-now-next",
    "record_type": "time_concept",
    "version": "1.0.0",
    "locale": "en-US",
    "age_band": "2-3",
    "status": "draft",
    "tags": [
      "pack-1",
      "sunny-home-garden"
    ],
    "created_by": "kilo",
    "reviewed_by": "founder",
    "notes_author": "DRAFT — pending founder review and signature, placeholder art, not live.",
    "concept_key": "now_next",
    "title_ref": "time_concept.now_next.title",
    "prompt_ref": "time_concept.now_next.prompt",
    "picture_set_id": "routine-cards-set"
  }
]
